,ID,title,description,Verified,subcount,viewcount,channel_name,date_uploaded,likes,dislikes,upvotes,rank,timestamp
0,MOUnnagwXSE,Barcelona v Paris Saint-Germain (1-4) | Mbappé bags Nou Camp hat-trick | Champions League Highlights,"Kylian Mbappé scored a stunning hat-trick on his first-ever visit to the Nou Camp, as PSG hammered Barcelona in their round of 16 first leg clash.

Hit 'Subscribe' above to ensure you never miss a video from the BT Sport YouTube channel.

Get a BT Sport Monthly Pass now! - ",True,3320000.0,1398687.0,BT Sport,16 Feb 2021,31355,397,0,1,Wed Feb 17 19:52:48 2021 to Wed Feb 17 21:08:47 2021
1,TOSGCehV9kk,Leipzig v Liverpool (0-2) | Salah and Mané give Reds timely win! | Champions League Highlights,"Second-half strikes from Mohamed Salah and Sadio Mané secured Liverpool a crucial two-goal victory over Leipzig, in their round of 16 first leg clash in Budapest.

Hit 'Subscribe' above to ensure you never miss a video from the BT Sport YouTube channel.

Click here to purchase a BT Sport Monthly Pass - ",True,3320000.0,956445.0,BT Sport,16 Feb 2021,14642,353,0,2,Wed Feb 17 19:52:48 2021 to Wed Feb 17 21:08:47 2021
2,gmRKv7n2If8,Disney's Cruella | Official Trailer,"Brilliant. Bad. A little bit mad. May 2021.

Academy Award® winner Emma Stone (“La La Land”) stars in Disney’s “Cruella,” an all-new live-action feature film about the rebellious early days of one of cinemas most notorious – and notoriously fashionable – villains, the legendary Cruella de Vil. “Cruella,” which is set in 1970s London amidst the punk rock revolution, follows a young grifter named Estella, a clever and creative girl determined to make a name for herself with her designs. She befriends a pair of young thieves who appreciate her appetite for mischief, and together they are able to build a life for themselves on the London streets. One day, Estella’s flair for fashion catches the eye of the Baroness von Hellman, a fashion legend who is devastatingly chic and terrifyingly haute, played by two-time Oscar® winner Emma Thompson (“Howards End,” “Sense & Sensibility”). But their relationship sets in motion a course of events and revelations that will cause Estella to embrace her wicked side and become the raucous, fashionable and revenge-bent Cruella.
 
Disney’s “Cruella” is directed by Craig Gillespie (“I Tonya”) from a screenplay by Dana Fox and Tony McNamara, story by Aline Brosh McKenna and Kelly Marcel & Steve Zissis. It was produced by Andrew Gunn (“Freaky Friday”), Marc Platt (“Mary Poppins Returns”) and Kristin Burr (“Christopher Robin”), with Emma Stone, Michelle Wright, Jared LeBoff and Glenn Close serving as executive producers. Two-time Oscar®- winning costume designer Jenny Beavan (“Mad Max: Fury Road,” “A Room with a View”) creates the dazzling and imaginative costumes, which take on a life of their own.

For more information on “Cruella,” follow us on:

Facebook: ",True,3820000.0,1695370.0,Walt Disney Studios,Premiered 6 hours ago,42860,1779,0,3,Wed Feb 17 19:52:48 2021 to Wed Feb 17 21:08:47 2021
3,XH6NvR8Fx_I,A DAY WITH ME IN LOCKDOWN | VLOG | MOLLYMAE,"HEY GUYS.....
I hope you enjoyed this VLOG, apologies for the lack of videos recently x

Molly-Mae x

SHOP REFY- ",False,1450000.0,481217.0,MollyMae,16 Feb 2021,27682,269,0,4,Wed Feb 17 19:52:48 2021 to Wed Feb 17 21:08:47 2021
4,FJTxFZARrO0,IT’S OVER! - No more Nike sponsorship,"Thanks to Nike for all the support over the last 4 years
My second channel: ",True,1460000.0,450466.0,Rick Shiels Golf,16 Feb 2021,12979,325,0,5,Wed Feb 17 19:52:48 2021 to Wed Feb 17 21:08:47 2021
5,JzOrZVpuJH8,Season Two Cinematic Trailer | Call of Duty®: Black Ops Cold War & Warzone™,Season Two Cinematic Trailer | Call of Duty®: Black Ops Cold War & Warzone™,True,6820000.0,1074125.0,Call of Duty,16 Feb 2021,0,49403,12361.0,6,Wed Feb 17 19:52:48 2021 to Wed Feb 17 21:08:47 2021
6,Wdnp89_GIxI,"Food Shop Haul, Meetings & Get Ready With Me!",Thank you to Stereo for partnering with me. Download Stereo and join me for my next show: ,True,572000.0,186916.0,Anastasia’s Vlogs,16 Feb 2021,12260,123,0,7,Wed Feb 17 19:52:48 2021 to Wed Feb 17 21:08:47 2021
7,xwdhHTtc-3,1 vs 10 Hunters in GTA!,"We played GTA V and did a Dream-style manhunt against 10 other players! This video is not only intense but also hilarious from beginning to end, so stick around for the whole thing!

SUBSCRIBE OR YOU'LL HAVE BAD LUCK

New Merch - shopmrbeast.com
Join our discord server for your chance to compete in future Minecraft challenges!",True,14700000.0,6733057.0,MrBeast Gaming,16 Feb 2021,388439,5185,0,8,Wed Feb 17 19:52:48 2021 to Wed Feb 17 21:08:47 2021
8,nCT3fgkBk,BAKING VALENTINES PANCAKES with BEHZINGA! 😘,"It's Pancake Day! So Ethan and I are back for the 3rd installment of our baking videos! :) 

Thank you Dr Jart+ for sponsoring, scan the QR code to try the portal out for yourself!

Ethan's channel: ",True,182000.0,299391.0,Elz the Witch,16 Feb 2021,34303,78,0,9,Wed Feb 17 19:52:48 2021 to Wed Feb 17 21:08:47 2021
9,Qh9KBwqGxTI,The Cost of Concordia,Go to ,True,2820000.0,1278651.0,Internet Historian,17 Feb 2021,200893,673,0,10,Wed Feb 17 19:52:48 2021 to Wed Feb 17 21:08:47 2021
10,9JTOwmM3Ta0,Daniel Ricciardo's McLaren MCL35M debut,We took our 2021 contender to the track at Silverstone for some filming day fun. Watch and listen to DR's first time in a McLaren Formula 1 car.,True,555000.0,405875.0,McLaren,17 Feb 2021,29193,65,0,11,Wed Feb 17 19:52:48 2021 to Wed Feb 17 21:08:47 2021
11,Zk7xww6K4xM,OFB - Daily Duppy | GRM Daily,"💿 COMING SOON: Drill Commandments out 18th March

🎹 PROD BY: Sensei & Bigzy x Ebononthetrack

🚨 SUBSCRIBE: ",True,3660000.0,844696.0,GRM Daily,Premiered on 15 Feb 2021,50150,791,0,12,Wed Feb 17 19:52:48 2021 to Wed Feb 17 21:08:47 2021
12,C0WuoQ-_8,What happened to my Lamborghini?,"A lot of people have been asking, so I explained everything!

Be part of my Project, right now - ",True,1620000.0,173339.0,Jay Swingler,16 Feb 2021,17386,141,0,13,Wed Feb 17 19:52:48 2021 to Wed Feb 17 21:08:47 2021
13,9PU0WZ0DxW,Eating McDonald's Happy Meals until I get EVERY POKEMON CARD!!,Go to ,True,13500000.0,1645738.0,Matt Stonie,16 Feb 2021,118242,3285,0,14,Wed Feb 17 19:52:48 2021 to Wed Feb 17 21:08:47 2021
14,VSly_E9,BRUTAL FRIENDSHIP TEST *too much tea*,MY FASHION BRAND:,True,314000.0,72862.0,Elmo Films,16 Feb 2021,6348,37,0,15,Wed Feb 17 19:52:48 2021 to Wed Feb 17 21:08:47 2021
15,dgETk7oubY,We Broke Up,We Broke Up,True,3510000.0,149344.0,FaZe Blaze,17 Feb 2021,19539,350,0,16,Wed Feb 17 19:52:48 2021 to Wed Feb 17 21:08:47 2021
16,XxGT_82_dbY,"4,000,000 COINS!!!! FIFA 21 Squad Builder Showdown TOTY Messi","This is a very late video I know xD Hope you enjoy it all the same, stay tuned for more videos! Go and follow me on twitch where we are also now streaming! twitch.tv/itsitsjames

Check out my song here:",False,114000.0,118269.0,ItsJames,16 Feb 2021,4828,37,0,17,Wed Feb 17 19:52:48 2021 to Wed Feb 17 21:08:47 2021
17,ZNexfJ6SeN4,“Drag Race” Contestant Sherry Pie Talks After Admitting to Catfishing,"Joey Gugliemelli is a drag performer who goes by the stage name Sherry Pie. Last year, they were publicly disqualified from Season 12 of “RuPaul's Drag Race” after admitting to sexually exploiting several men. Joey exclusively opens up for the first time in a sit-down with Tamron Hall.",False,120000.0,63305.0,Tamron Hall Show,16 Feb 2021,794,1682,0,18,Wed Feb 17 19:52:48 2021 to Wed Feb 17 21:08:47 2021
18,kWitT79g,Valentines Day PRANKS on my Friends!!,"Don't forget to SUBSCRIBE and TURN ON POST NOTIFICATIONS!

Follow my other social medias! 
Instagram - @ANDREWDAVILA_
Tik Tok - @ANDREW.DAVILA


Lexi's YouTube: @Alexa Rivera  
Jeremy's YouTube:  ",True,1300000.0,298949.0,Andrew Davila,17 Feb 2021,38575,245,0,19,Wed Feb 17 19:52:48 2021 to Wed Feb 17 21:08:47 2021
19,M678ialAwA,Trying Tactical Products,"this video is about trying tac products is what i'm doing in this video
thanks to Christian for filming ",False,1150000.0,406480.0,2 Danny 2 Furious,16 Feb 2021,56384,174,0,20,Wed Feb 17 19:52:48 2021 to Wed Feb 17 21:08:47 2021
20,jMlE9WWxdKg,Microsoft Flight Simulator - United Kingdom & Ireland World Update,"Take flight into a region rich with tradition, culture and heritage -- not to mention a fair share of myth and legend. From seats of royalty to centers of finance, bustling metropolitan hubs to sprawling farmsteads and cliffside villages, the splendor of the United Kingdom and Ireland is on full display with dramatic upgrades and visual enhancements. 

This update is FREE to all Microsoft Flight Simulator players.  

Get it Now on Windows 10, Xbox Game Pass for PC, and Steam: ",True,4390000.0,115156.0,Xbox,16 Feb 2021,4156,46,0,21,Wed Feb 17 19:52:48 2021 to Wed Feb 17 21:08:47 2021
21,ZSlJGWM4T7,2021 McLaren Team Launch | LIVE from the MTC | #SendIt,"Join us for our 2021 Team Launch, LIVE from the McLaren Technology Centre. See the ",True,555000.0,1044336.0,McLaren,Streamed live on 15 Feb 2021,40405,670,0,22,Wed Feb 17 19:52:48 2021 to Wed Feb 17 21:08:47 2021
22,BSfkx5shk,But Did He Do It? The Mysterious Story Of Laci & Scott Peterson | Mystery & Makeup - Bailey Sarian,Audible is offering 6 months of Audible for just $9.95 a month! Visit  ,True,4070000.0000000005,2001185.0,Bailey Sarian,15 Feb 2021,124730,1467,0,23,Wed Feb 17 19:52:48 2021 to Wed Feb 17 21:08:47 2021
23,D_LQWv8Ts40,World Falling Mod with Ranboo is Hilarious!,"Me and Ranboo played the ""Falling Falling"" map and had lot's of funny! I PROMIES!

100k likes?

Editor: ",False,1170000.0,1455728.0,Tubbo,15 Feb 2021,154418,1204,0,24,Wed Feb 17 19:52:48 2021 to Wed Feb 17 21:08:47 2021
24,9MnBGpFeYlI,What REALLY Happened To Ravel Morrison | United's Defensive Problems | Vibe With FIVE,"Rio Ferdinand, Stephen Howson and Joel Beya are back with another episode of Vibe With FIVE. Today, the lads are joined by Ravel Morrison to discuss everything that has happened throughout his career and what his next steps are. We talk about his time at Manchester United, his dispute with Wilfried Zaha and he discusses the mental struggles of being a young professional footballer.

Rio Ferdinand Instagram: ",False,663000.0,210383.0,Rio Ferdinand Presents FIVE,15 Feb 2021,6133,67,0,25,Wed Feb 17 19:52:48 2021 to Wed Feb 17 21:08:47 2021
25,Uy4_C6Ev8S8,"Sam Fischer, Demi Lovato - What Other People Say (Official Video)","Sam Fischer & Demi Lovato – What Other People Say (Official Video)

Listen to ‘What Other People Say' here: ",True,144000.0,537371.0,Sam Fischer,Premiered on 16 Feb 2021,56253,528,0,26,Wed Feb 17 19:52:48 2021 to Wed Feb 17 21:08:47 2021
26,WMAcwJ5lUzE,slowthai - TYRON ALBUM REVIEW,Listen: ,True,2330000.0,147360.0,theneedledrop,17 Feb 2021,9779,78,0,27,Wed Feb 17 19:52:48 2021 to Wed Feb 17 21:08:47 2021
27,L-x8DYTOv7,YouTubers have to declare ads. Why doesn't anyone else?,"Around the world, there are regulations for ""influencers"". Those regulations make sure that if someone is paid to endorse a product, they have to declare that payment to the people watching. But why does no-one on TV, or film, or anywhere else have to do that?

👥👥 CREDITS 👥👥

Written and performed by TOM SCOTT ",True,3540000.0,1267220.0,Tom Scott,15 Feb 2021,137494,805,0,28,Wed Feb 17 19:52:48 2021 to Wed Feb 17 21:08:47 2021
28,7RHIb7mCw7I,Our Response to Robbie from AFTV,Subscribe to Robbie's new channel: ,True,483000.0,120219.0,Thogden,16 Feb 2021,14632,622,0,29,Wed Feb 17 19:52:48 2021 to Wed Feb 17 21:08:47 2021
29,I1PiTGkSJhI,HANGING TREE HOUSE FORTS!,"We built hanging treehouse forts!

BRAND NEW MERCH! ► ",True,5830000.0,628568.0,MoreJStu,16 Feb 2021,29783,420,0,30,Wed Feb 17 19:52:48 2021 to Wed Feb 17 21:08:47 2021
30,WoeCuZLJZoI,Beating Mario Odyssey Exactly as Nintendo Intended,"""Speedruns are CHEATING""

You should watch me live on Twitch:",True,1210000.0,596393.0,SmallAnt,16 Feb 2021,33386,367,0,31,Wed Feb 17 19:52:48 2021 to Wed Feb 17 21:08:47 2021
31,N2J2k-W7E5U,James Welsh’s Ultra-Hydrating Nighttime Skincare Routine | Go To Bed With Me | Harper’s BAZAAR,You’ve likely seen ,True,1410000.0,95111.0,Harper's BAZAAR,16 Feb 2021,9187,70,0,32,Wed Feb 17 19:52:48 2021 to Wed Feb 17 21:08:47 2021
32,41d9fTcY2LI,McLaren Artura revealed - launch of all new hybrid supercar,"The McLaren Artura is a creation that draws together decades of our pioneering expertise. The result is an incredible next-generation supercar alive with the full force of McLaren. 
 
Join us for the global reveal of Artura at ",False,257000.0,139888.0,McLaren Automotive,Premiered 20 hours ago,6982,74,0,33,Wed Feb 17 19:52:48 2021 to Wed Feb 17 21:08:47 2021
33,J35RChPTq,I STOLE The ENDERDRAGON In My MINECRAFT TROLL WORLD!,"I STOLE The ENDERDRAGON In My MINECRAFT TROLL WORLD! If you enjoyed this video, watch more here: ",True,20900000.0,1285470.0,Jelly,16 Feb 2021,88414,1502,0,34,Wed Feb 17 19:52:48 2021 to Wed Feb 17 21:08:47 2021
34,gjYRvAMz,"DUSTY LOCANE - INTRO 2 ME, PT. 1 (Official Music Video)","DUSTY LOCANE - INTRO 2 ME, PT. 1 (Official Music Video)
Stream: ",True,193000.0,275094.0,DUSTY LOCANE,Premiered 17 hours ago,39581,344,0,35,Wed Feb 17 19:52:48 2021 to Wed Feb 17 21:08:47 2021
35,_Pn-ePPvKg,I Restored this Broken and Cracked Tank for 'Mister Patina',"Mister Patina was recently restoring a german stove from 1920. The tank of it was cracked, the thread for the cap was missing, the cap itself and more. As this job was too much for his current knowledge he asked me if I could help him. I really liked this challenge and I said yes. Soldering is also something I'm not very used to, so it will also be an interesting job for me and it would make a nice little video for the second channel.
From the first pictures of the tank I haven't realized that this is made out of three parts. I quickly saw that when it arrived in my shop. That made it a lot easier to repair the cracks. I took all parts apart. Repaired the cracks from the inside, covered all the inside to pervent future cracks and soldered the three parts back together. To stabilize the brittle tank I used aluminium rings. Then I turned a new part with an inside thread for the fuel cap and soldered that in place. After that I made the fuel cap and the bleed screw, to seal them I used one o-ring each which worked absolutely perfect. I gave the whole thing a nice brushed finish and the job was done.

I hope you like my work and the video.

Here's the link to Mister Patina's video:",True,238000.0,61098.0,my mechanics insights,17 Feb 2021,5464,45,0,36,Wed Feb 17 19:52:48 2021 to Wed Feb 17 21:08:47 2021
36,8ilqVs6Ch0,Referee clashes with Ipswich midfielder Alan Judge,SUBSCRIBE ► ,True,2750000.0,128069.0,Sky Sports Football,17 Feb 2021,2171,63,0,37,Wed Feb 17 19:52:48 2021 to Wed Feb 17 21:08:47 2021
37,7LaxOQbCnyQ,"10,000 CALORIE CHALLENGE | GIRL VS: FOOD: EPIC CHEAT DAY","I threw up...
I attempted the 10k calorie challenge for the first time ever and I can't believe what I went through...so much pain.
STREAM MY NEW SONG ON SPOTIFY- ",True,1380000.0,309782.0,Millie T,15 Feb 2021,15045,384,0,38,Wed Feb 17 19:52:48 2021 to Wed Feb 17 21:08:47 2021
38,ZPHvH7D6qQY,Xbox Wireless Headset - Launch Trailer,"Game loud and clear with the all-new Xbox Wireless Headset, featuring auto-mute and voice isolation for crystal-clear chat, intuitive design, and direct pairing to your console.

Learn more: ",True,4390000.0,430141.0,Xbox,16 Feb 2021,21671,461,0,39,Wed Feb 17 19:52:48 2021 to Wed Feb 17 21:08:47 2021
39,fujEnmIOuEM,The New Northern Line Platform at Bank,"The Bank Capacity Upgrade works are now over halfway complete, but is sometimes forgotten with the Northern Line Extension and Crossrail being likely to finish and open first.

So here's a quick overview of everything you need to know and some fancy graphics to show you how and where Bank station is going to change - similar to how Angel and Euston on the Northern Line have wide platforms when they were upgraded from island platforms.

TfL Project page on Bank station: ",True,210000.0,66443.0,Geoff Marshall,16 Feb 2021,3444,30,0,40,Wed Feb 17 19:52:48 2021 to Wed Feb 17 21:08:47 2021
40,rHJrqHzKE,QUIT THE SIDEMEN OR QUIT DRINKING?,Check out Stereo & follow us. Links below!,True,4830000.0,1270242.0,MoreSidemen,16 Feb 2021,81011,982,0,41,Wed Feb 17 19:52:48 2021 to Wed Feb 17 21:08:47 2021
41,x9HotRg6AU,Lil Tjay & 6LACK - Calling My Phone (BTS),"Official BTS Video for ""Calling My Phone"" by Lil Tjay featuring 6LACK. 

Listen & Download “Calling My Phone” by out now: ",True,2820000.0,242497.0,Lil Tjay,Premiered 20 hours ago,29013,116,6252.0,42,Wed Feb 17 19:52:48 2021 to Wed Feb 17 21:08:47 2021
42,ZKTUaUjONHU,FC Bayern München - Arminia Bielefeld | 3-3 | Highlights | Matchday 21 – Bundesliga 2020/21,FC Bayern München - Arminia Bielefeld | 3-3 | Highlights | Matchday 21 – Bundesliga 2020/21,True,2480000.0,974919.0,Bundesliga,15 Feb 2021,18900,369,0,43,Wed Feb 17 19:52:48 2021 to Wed Feb 17 21:08:47 2021
43,LYwl23w8qhY,VALENTINES DAY BAKING CHALLENGE❣️,VALENTINES DAY BAKING CHALLENGE❣️,False,675000.0,242739.0,Jordyn & Alphonso,16 Feb 2021,30849,133,0,44,Wed Feb 17 19:52:48 2021 to Wed Feb 17 21:08:47 2021
44,Nlzehe4mta4,What will the world look like in 250 million years?,Download the Stereo app for free: ,True,865000.0,464944.0,Jay Foreman,15 Feb 2021,37516,243,0,45,Wed Feb 17 19:52:48 2021 to Wed Feb 17 21:08:47 2021
45,_fqjDAR6MNI,Minecraft's History of Easter Eggs,Minceraft is full of hidden and secret features that have been added over the years. Today we dive into the history of Minecraft's Easter eggs from Herobrine in version 1.0 to secret dimensions in 1.17. Enjoy this video I blatantly ripped off of ,False,231000.0,778721.0,Wifies,15 Feb 2021,33792,431,0,46,Wed Feb 17 19:52:48 2021 to Wed Feb 17 21:08:47 2021
46,ZwwnfRYFuYQ,"Fortnite Update 15.40: EVERYTHING You Need To Know In UNDER 5 MINUTES (Flintknock, Midas, & More!)",Want 24/7 On-Demand Coaching? As Well as Instant VOD Review From TOP Pros? Head on over to: ,True,974000.0,343455.0,"ProGuides Fortnite Tips, Tricks and Guides",16 Feb 2021,7441,423,0,47,Wed Feb 17 19:52:48 2021 to Wed Feb 17 21:08:47 2021
47,Bw69QXyFmt4,Gather for the Short Nite Film Festival in Fortnite Party Royale!,Fortnite Presents Short Nite comes to the Big Screen in Party Royale on Feb 20 at 2 PM ET. Info: ,True,10400000.0,591295.0,Fortnite,16 Feb 2021,44854,808,0,48,Wed Feb 17 19:52:48 2021 to Wed Feb 17 21:08:47 2021
48,H2tKigOPBU,Mars Rover Landing CRASH COURSE- 1 DAY LEFT!,"This will be cooler than the Super Bowl. Thanks to Bill and Melinda Gates for partnering with me on this video. Read the 2021 Annual Letter, here: ",True,16800000.0,6261772.0,Mark Rober,15 Feb 2021,395353,3802,0,49,Wed Feb 17 19:52:48 2021 to Wed Feb 17 21:08:47 2021
49,J3bKwnP4ak,Marvel's Avengers WAR TABLE Deep Dive - Hawkeye,"Hawkeye's story brings us face to face with a possible future where all hope is lost. 

With his bow and sword at his side - and the help of the rest of the Avengers - Clint must stop an invasion that would turn the world to ruin. Operation: Hawkeye - Future Imperfect will be available on March 18! ",True,0.0,76031.0,Marvel's Avengers,16 Feb 2021,3553,377,0,50,Wed Feb 17 19:52:48 2021 to Wed Feb 17 21:08:47 2021
50,KF8I09WBtEI,SIDEMEN TINDER IN REAL LIFE 3,Chunkz: ,True,10800000.0,17442082.0,Sidemen,7 Feb 2021,995310,9406,0,51,Wed Feb 17 19:52:48 2021 to Wed Feb 17 21:08:47 2021
51,_uwNDiU04zE,Press Subscribe For $.10,"Subscribe and I'll Donate $0.10 To Charity
Play Rogue Company FREE today! ",True,53600000.0,19970000.0,MrBeast,13 Feb 2021,1731586,13100,0,52,Wed Feb 17 19:52:48 2021 to Wed Feb 17 21:08:47 2021
52,WbHGtGSwoGA,Central Cee - Commitment Issues [Music Video],📀 Pre-order Wild West: ,True,73900.0,1653456.0,Central Cee,Premiered on 11 Feb 2021,74365,678,0,53,Wed Feb 17 19:52:48 2021 to Wed Feb 17 21:08:47 2021
53,zzd4ydafGR0,Lil Tjay - Calling My Phone (feat. 6LACK) [Official Video],"Official audio for ""Calling My Phone"" by Lil Tjay featuring 6LACK. 

Listen & Download “Calling My Phone” by out now: ",True,2820000.0,9687869.0,Lil Tjay,Premiered on 12 Feb 2021,640620,6356,0,54,Wed Feb 17 19:52:48 2021 to Wed Feb 17 21:08:47 2021
54,q6X6alZ3,Ariana Grande - 34+35 Remix (feat. Doja Cat and Megan Thee Stallion) (Official Video),The official “34+35 Remix” music video by Ariana Grande feat. Doja Cat and Megan Thee Stallion. Listen & download here: ,True,47000000.0,23754888.0,Ariana Grande,Premiered on 12 Feb 2021,1504909,37757,0,55,Wed Feb 17 19:52:48 2021 to Wed Feb 17 21:08:47 2021
55,Qcguapz5YuY,Jordan - Daily Duppy | GRM Daily,"🎹 PROD: Mikey Joe & @jesterbeatss

🚨 SUBSCRIBE: ",True,3660000.0,965947.0,GRM Daily,Premiered on 12 Feb 2021,32153,907,0,56,Wed Feb 17 19:52:48 2021 to Wed Feb 17 21:08:47 2021
56,M-Bja2Gy04,Zack Snyder's Justice League | Official Trailer | HBO Max,"In Zack Snyder's Justice League, determined to ensure Superman’s (Henry Cavill) ultimate sacrifice was not in vain, Bruce Wayne (Ben Affleck) aligns forces with Diana Prince (Gal Gadot) with plans to recruit a team of metahumans to protect the world from an approaching threat of catastrophic proportions. The task proves more difficult than Bruce imagined, as each of the recruits must face the demons of their own pasts to transcend that which has held them back, allowing them to come together, finally forming an unprecedented league of heroes. Now united, Batman (Affleck), Wonder Woman (Gadot), Aquaman (Jason Momoa), Cyborg (Ray Fisher), and The Flash (Ezra Miller) may be too late to save the planet from Steppenwolf, DeSaad, and Darkseid and their dreadful intentions.

Subscribe: ",True,551000.0,17751641.0,HBO Max,14 Feb 2021,471300,14869,0,57,Wed Feb 17 19:52:48 2021 to Wed Feb 17 21:08:47 2021
57,9rhadTURsr,The Weeknd’s FULL Pepsi Super Bowl LV Halftime Show,"The Weeknd performs at the Super Bowl LV Pepsi Halftime Show.

Subscribe to NFL: ",True,7720000.0,27951332.0,NFL,8 Feb 2021,1109135,57016,0,58,Wed Feb 17 19:52:48 2021 to Wed Feb 17 21:08:47 2021
58,ZquDW-b1A7g,Digga D x AJ Tracey - Bringing It Back,Digga D x AJ Tracey - Bringing It Back,True,167000.0,4417947.0,Digga D TV,Premiered on 4 Feb 2021,136939,968,0,59,Wed Feb 17 19:52:48 2021 to Wed Feb 17 21:08:47 2021
59,q26a93iES3E,SIDEMEN GUESS THE SONG CHALLENGE!,• Sidemen: ,True,4830000.0,2919689.0,MoreSidemen,13 Feb 2021,191400,947,0,60,Wed Feb 17 19:52:48 2021 to Wed Feb 17 21:08:47 2021
60,dFrfBEJfkj,SIDEMEN GUESS THE FAKE COUPLE,"Today the Sidemen attempt to find a fake couple!
👉🏻 Subscribe to our 2nd Channel: ",True,10800000.0,6171624.0,Sidemen,14 Feb 2021,388239,3099,0,61,Wed Feb 17 19:52:48 2021 to Wed Feb 17 21:08:47 2021
61,Nl1PDCFTxFY,Abra Cadabra - Mixed Emotions (Official Video),Mixed Emotions EP Out Now On All Digital Platforms. ,True,0.0,506968.0,Abra Cadabra,Premiered on 14 Feb 2021,36215,226,0,62,Wed Feb 17 19:52:48 2021 to Wed Feb 17 21:08:47 2021
62,0kEWtLEtAY,"If The Footballer Replies, I Keep Their Card (IT WORKED) - Fifa 21 Pack Opening","The greatest pack I have ever opened. Just would be this video wouldn't it
Subscribe to Ollie: ",True,5140000.0,1060479.0,ChrisMD,12 Feb 2021,50311,1103,0,63,Wed Feb 17 19:52:48 2021 to Wed Feb 17 21:08:47 2021
63,8ds6SnOG,Minecraft Speedrunner VS 4 Hunters GRAND FINALE,"Minecraft Speedrunner VS 4 Hunters GRAND FINALE. You asked for it. This was absolutely insane. ► Download Monster Legends from this link to play for FREE! Get your Dream Monster and feed him to Level 10 to enter the $5,000 USD GIVEAWAY! ",True,18200000.0,24446331.0,Dream,Premiered on 5 Feb 2021,1993712,30907,0,64,Wed Feb 17 19:52:48 2021 to Wed Feb 17 21:08:47 2021
64,BMM4UIetbj,24 Hours Being PREGNANT!!,"HI SISTERS! In today's video, I'm trying something I'll never get to experience, being pregnant! My best friend Laura is pregnant with her second baby so she challenged me to be pregnant for 24 hours to see if I was strong enough to go through what she does! 💪🏼 I hope you enjoy the video and don't forget to thumbs up and subscribe!

🎥 PREVIOUS VIDEO » ",True,25600000.0,8155552.0,James Charles,12 Feb 2021,0,0,0,65,Wed Feb 17 19:52:48 2021 to Wed Feb 17 21:08:47 2021
65,lgGmYeAm0jk,Best of the Handforth Parish Council Planning & Environment Committee Thursday 10th December 2020,The best bits of the extraordinary meeting of the Handforth Parish Council Planning and Environment Committee held on Thursday 10th December 2020 at ,False,2800.0,3254919.0,Steven Morgan,4 Feb 2021,0,0,0,66,Wed Feb 17 19:52:48 2021 to Wed Feb 17 21:08:47 2021
66,Qp3c6yqn93I,Headie One - Siberia (Official Video) ft. Burna Boy,Headie One - Siberia (Official Video) ft. Burna Boy,True,293000.0,980272.0,Headie One,Premiered on 11 Feb 2021,33908,439,0,67,Wed Feb 17 19:52:48 2021 to Wed Feb 17 21:08:47 2021
67,gXDd3AZjil0,#OFB Bandokay x Double Lz x Izzpot - YKTV [ Official Music Video ],SUBSCRIBE HERE: ,True,258000.0,508700.0,OFB OFFICIAL,Premiered on 11 Feb 2021,28633,299,0,68,Wed Feb 17 19:52:48 2021 to Wed Feb 17 21:08:47 2021
68,Lnmd3kZPXUQ,Abra Cadabra Ft. Kush - U Know (Official Video),"U Know

Out Now On All Digital Platforms: ",True,0.0,511846.0,Abra Cadabra,Premiered on 12 Feb 2021,29330,206,0,69,Wed Feb 17 19:52:48 2021 to Wed Feb 17 21:08:47 2021
69,6q-8Q4zng,I BOUGHT A NEW HOUSE!! (2021),Current is the future of banking!! Use promo code David for the chance to win some points for cash! ,True,8710000.0,11461589.0,David Dobrik Too,8 Feb 2021,1070286,16562,0,70,Wed Feb 17 19:52:48 2021 to Wed Feb 17 21:08:47 2021
